{
  "$schema": "https://json-schema.org/draft/2020-12/schema",
  "title": "HULK SA Compatibility V2 result",
  "type": "object",
  "required": ["schema_version", "generated_at", "summary", "checks"],
  "properties": {
    "schema_version": {"const": 2},
    "generated_at": {"type": "string"},
    "summary": {
      "type": "object",
      "required": ["PASS", "FAIL", "BLOCKED", "SKIPPED"],
      "additionalProperties": {"type": "integer", "minimum": 0}
    },
    "checks": {
      "type": "array",
      "items": {
        "type": "object",
        "required": ["id", "status", "message"],
        "properties": {
          "id": {"type": "string", "minLength": 1},
          "status": {"enum": ["PASS", "FAIL", "BLOCKED", "SKIPPED"]},
          "message": {"type": "string"},
          "evidence": {"type": "array", "items": {"type": "string"}}
        },
        "additionalProperties": false
      }
    }
  },
  "additionalProperties": false
}
